{
  "schemaVersion": "1.0",
  "fileId": "10000000-0000-4000-8000-000000000001",
  "version": 1,
  "sequence": 1,
  "sha256": "2d711642b726b04401627ca9fbac32f5da7e5c8530fb1903cc4db02258717921",
  "verdict": "clean",
  "scannerRef": "synthetic-contract-scanner",
  "scannedAt": "2026-08-05T12:00:05Z"
}
